"file","category","what_it_is","when_to_use","source","size_kb","present"
"hampshire_parcels.kml","Parcels","All Hampshire College parcels in Amherst and Hadley, each placemark labeled with the parcel ID. Clicking a parcel opens a balloon showing owner, zoning, land use, acres, FY assessed value, and encumbrance (creditor, silo year, instrument, book and page).","When you need any parcel-level information (ownership, zoning, encumbrance, value). Drop this on top of any basemap for context.","MassGIS Level 3 Standardized Assessors' Parcels (Amherst FY2024, Hadley FY2025) plus encumbrance lookup from the Hampshire County Registry of Deeds and Hampshire College FY2025 audit.",45.5,TRUE
"protected_open_space.kml","Protected land","MassGIS Protected and Recreational Open Space polygons clipped to a 500-meter envelope around the Hampshire parcels. Each placemark balloon shows site name, owner type (municipal, state, federal, land trust, private nonprofit, other), protection level (permanent, limited, none), and mapped acres.","When you want to see what's permanently conserved around the Hampshire holdings. Useful for understanding which neighbors are off the market or which areas already form a regional green network.","MassGIS Protected and Recreational Open Space.",123.7,TRUE
"wetlands_actual.kml","Wetlands","MassDEP regulatory wetland polygons themselves, one placemark per wetland, clipped to a 500-meter envelope around the Hampshire parcels. Each placemark balloon shows the wetland cover type (wooded swamp, shrub swamp, shallow marsh, deep marsh, open water, bog, etc.) and mapped acres.","When you want to see only the actual wetland edges, without any buffer. Useful for orientation and for identifying cover types per wetland.","MassGIS DEP Wetlands (regulatory polygons, photo-interpreted at ~1:12,000).",147.1,TRUE
"wetlands_buffer_0_to_100ft.kml","Wetlands","The 0 to 100 ft ring around every wetland: the Massachusetts Wetlands Protection Act Buffer Zone. Drawn as the difference between the 100 ft buffer and the wetland itself, so it occupies its own ring with no overlap.","When the conversation is about the standard state-WPA buffer reach. This is the regulatory boundary triggered by a Notice of Intent.","Derived locally by buffering DEP wetlands 100 ft outward in MA State Plane Mainland (EPSG:26986), then differencing the wetland itself.",522.7,TRUE
"wetlands_buffer_100_to_200ft.kml","Wetlands","The 100 to 200 ft ring beyond the WPA Buffer Zone: an additional band that approximates the Riverfront Area and a conservative reading of Amherst's local Wetlands Protection Bylaw. Drawn as the difference between the 200 ft and 100 ft buffers, so it occupies its own ring with no overlap.","When you want to flag the additional area covered under a conservative or strict-buffer scenario, such as Amherst's local bylaw read generously. Use alongside the 0 to 100 ft ring to show the total regulated reach.","Derived locally by buffering DEP wetlands 200 ft outward and differencing the 100 ft buffer.",716.2,TRUE
"wetlands_actual_plus_200ft_envelope.kml","Wetlands","A single unioned polygon: every wetland plus its 200 ft outward buffer, merged into one shape. Combines the three-layer split (actual + 0 to 100 ft ring + 100 to 200 ft ring) into one toggle for the total regulated reach.","When you want one toggle that shows the full regulated extent (wetland plus 200 ft) without managing three layers. Visually equivalent to turning on all three split layers together.","Derived locally by buffering DEP wetlands 200 ft outward and unioning.",289.3,TRUE
